{"lessonId":"10000000-0000-0000-0000-000000000002","version":1,"title":"Published lesson","description":"Immutable snapshot","sourceRevision":11,"publishedAt":"2026-01-03T00:00:00Z","blocks":[{"blockId":"30000000-0000-0000-0000-000000000001","blockType":"HEADING","blockSchemaVersion":1,"position":0,"configuration":{"text":"Published","level":1}}]}